Бариста,Prosvet coffee,2025-10-20,70.0,90.0,4320.0,360.0,12.0,От 1 года до 3 лет,ТК,5/2,2 раза в месяц,"питание, бесплатное питание, кофе","Опыт работы на должности <highlighttext>бариста</highlighttext> будет преимуществом, но не обязателен. Отличные коммуникативные навыки. Пунктуальность, опрятность, работа в команде.",https://hh.ru/vacancy/126528702
Бармен-Бариста ( Администратор мини-кофейни ),Клепиков Сергей Михайлович,2025-10-20,74.4,91.1,,,,Нет опыта,ТК,64/27,Еженедельно,"форма, обучение",Приготовление напитков. Поддержание чистоты за баром.,https://hh.ru/vacancy/126140811
Бариста,Кофейня COFFEIRA,2025-10-21,85.0,95.0,4560.0,380.0,12.0,Нет опыта,ТК,"5/2, 7/40, 18/30",Еженедельно,,"настраивать помол, варить качественный эспрессо, продавать сопутствующие закуски, чистота рабочего места",https://hh.ru/vacancy/126545313
Бариста,Кофейня Bodriy,2025-10-19,4.5,5.0,3000.0,250.0,12.0,Нет опыта,ТК,5/2,,кофе,"Открытие и закрытие рабочей смены. Работа за баром - приготовление напиток,оформление витрины и поддержания чистоты. Ответственность, пунктуальность, честность. Работа с остатками,поставками. Работа по технологическим картам. Доброжелательность к гостям,желание находится и поддерживать дружелюбную атмосферу, заинтересованость в работе.",https://hh.ru/vacancy/126690166
Бариста в кофейню One Price Coffee (м. Марьино),OnePrice Coffee,2025-10-21,86.2,,,,,Нет опыта,ТК,2/2,,"питание, обучение, кофе","Приготовление кофейных напитков по утвержденным рецептам Работа с кассой и участие в инвентаризациях Поддержание уютной атмосферы в кофейне, создание позитивного настроения для наших гостей Соблюдение чистоты и порядка на рабочем месте Требования к тебе: Любовь к кофе Приветливость, коммуникабельность, энтузиазм Готовность учиться новому и развиваться профессионально Пунктуальность и ответственность Присоединяйся к нам и стань частью команды, где каждая чашка кофе - это искусство и удовольствие. Мы гарантируем, что ты не только научишься готовить вкуснейший кофе, но и найдешь здесь друзей и возможность развиваться вместе с нами! :)",https://hh.ru/vacancy/126211042
Бариста,СЕРВИС ТРАНС ЭКСПЕДИЦИЯ,2025-10-20,4.0,4.5,3960.0,330.0,12.0,Нет опыта,ТК,2/2,2 раза в месяц,"форма, униформа, кофе",✓ Приготовление кофе на рожковой кофемашине ✓ Работа с кассой ✓ Дружелюбное общение с гостями и активные продажи ✓ Поддержание чистоты на рабочем месте и выкладка продукции Оставь ОТКЛИК / ЗВОНИ. Стань частью нашей кофейной семью❤ #HH-1888#,https://hh.ru/vacancy/126299513
Бариста,Мокко,2025-10-22,110.0,120.0,,,12.0,Нет опыта,ТК,5/2,Ежемесячно,"питание, кофе","Бариста в кофейню «Варим кофе» ☕ 🌿 Что ты будешь делать: ✨ Готовить напитки по стандартам Specialty кофе. ✨ Работать с кофемашиной La Marzocco и альтернативой (V60, фильтр). ✨ Общаться с гостями, подбирать напитки по настроению. ✨ Поддерживать уют и порядок за стойкой — ведь атмосфера начинается с бариста.",https://hh.ru/vacancy/126688422
Бариста,Кофейня Cofix,2025-10-21,40.0,90.0,,,,Нет опыта,ТК,5/2,2 раза в месяц,"обучение, кофе",Приготовление напитков по техническим картам с соблюдением рецептур сети; • Поддержание чистоты на рабочем месте; • Работа с кассой; • Приветливость и забота о гостях.,https://hh.ru/vacancy/126545120
Утренний бариста в кофейню Дринкит (м.Коммунарка),Дринкит - сеть кофеен,2025-10-21,50.0,70.0,3300.0,275.0,'5-12,Нет опыта,ТК,5/12,2 раза в месяц,"обучение, кофе",Готовить кофе и другие напитки. Проводить уборку рабочей зоны. Общаться с гостями.,https://hh.ru/vacancy/126339499
Бариста в кофейню,Coffee Point,2025-10-21,75.0,110.0,,,,Нет опыта,ТК,5/2,2 раза в месяц,"питание, бесплатное питание, форма, бонус, бонусы, подарки, обучение, кофе",Готовить ароматный кофе и авторские напитки. Работать с кассой и помогать гостям с выбором. Следить за уютом и чистотой кофейни. ,https://hh.ru/vacancy/123733439
Бариста,Здрасте,2025-10-22,70.0,95.0,,,14.0,Нет опыта,ТК,"2/2, 5/2",,"питание, бесплатное питание, бонус, бонусы, обучение, кофе",Приготовление кофе и других напитков по стандартам компании. - Обслуживание гостей с улыбкой и заботой. - Поддержание чистоты и порядка на рабочем...,https://hh.ru/vacancy/126833777
Бариста / Кассир в кофейню при поликлинике,Coffee Point,2025-10-17,75.0,110.0,,,,Нет опыта,ТК,5/2,2 раза в месяц,"питание, бесплатное питание, форма, бонус, бонусы, подарки, обучение, кофе, чай",Приготовление ароматного кофе и напитков по фирменным рецептам. - Помощь гостям в выборе и создание приятного впечатления. - Работа с кассой и...,https://hh.ru/vacancy/126639860
Бариста в Cofix,Cofix (ИП Курбанов-Осипов Михаил Александрович),2025-10-19,65.0,80.0,,,,Нет опыта,ТК,"30/15, 30/23",2 раза в месяц,"обучение, кофе",Приготовление напитков по техническим картам с соблюдением рецептур сети; • Поддержание чистоты на рабочем месте; • Работа с кассой; • Приветливость и забота о гостях и коллегах.,https://hh.ru/vacancy/125866832
Бариста в ТРЦ Columbus,Хлеб с маслом,2025-10-20,71.4,85.2,,,,Нет опыта,ТК,"2/2, 4/2, 3/3",2 раза в месяц,"питание, бесплатное питание, форма, обучение, кофе","Приготовление кофейных напитков Прием заказов в формате togo; помощь и активные доп. продажи гостям при выборе напитков/ выпечки Расчет гостей, работа с кассой Оформление витрин Соблюдение стандартов компании Создание позитивной и уютной атмосферы кофейни",https://hh.ru/vacancy/125902040
"Бариста в кафе ""Братья Караваевы""",Кулинарная лавка братьев Караваевых,2025-10-19,,120.0,,,,Нет опыта,ТК,6/1,2 раза в месяц,"питание, форма, обучение, кофе",Консультируют покупателей по ассортименту напитков и десертов. Информируют гостей о действующей системе лояльности. Производят расчëт гостей на кассе. ,https://hh.ru/vacancy/125802231
Бариста “Cofix”,Овчинников Иван Сергеевич,2025-10-20,40.0,70.0,,,,Нет опыта,ТК,"30/15, 30/23",2 раза в месяц,"обучение, кофе",Приготовление напитков по техническим картам с соблюдением рецептур сети; • Поддержание чистоты на рабочем месте; • Работа с кассой; • Приветливость и забота о гостях и коллегах.,https://hh.ru/vacancy/126427539
Бариста-бармен,Novikov Space,2025-10-20,75.0,,,,,Нет опыта,ТК,2/2,,"питание, бонус, бонусы, обучение, кофе",Приготовление напитков по меню. - Поддержание чистоты и порядка на баре. - Работа с поставщиками и контроль запасов. - Проведение инвентаризаций.,https://hh.ru/vacancy/126528281
Бариста,Спектр,2025-10-21,85.0,105.0,,,,Нет опыта,ТК,6/1,2 раза в месяц,"скидки, обучение, кофе",* Приготовление кофе и других напитков по авторским рецептам. * Обслуживание клиентов на высоком уровне. * Поддержание чистоты и порядка на рабочем месте. * Работа с кассой и ведение учёта продаж.,https://hh.ru/vacancy/125982564
Бариста (м. Останкино),ДНИ НЕДЕЛИ,2025-10-20,120.0,,3600.0,300.0,13.0,От 1 года до 3 лет,ТК,"5/2, 3/3, 2/2",Ежемесячно,"обучение, кофе","Готовить авторские напитки, разумеется, не забывая про классику. Заниматься развитием кофейни и работать над узнаваемостью бренда. Принимать активное участие в...",https://hh.ru/vacancy/126732198
Старший бариста кофейни,КофеБрейк,2025-10-21,90.0,110.0,,,,От 1 года до 3 лет,ТК,5/2,,кофе,Функционал позиции: Управление и контроль работы команды смены. Выполнение плановых показателей по продажам. Заказы и контроль поставок. Выполнение и контроль...,https://hh.ru/vacancy/125861256
Бариста,Уголок (ИП Кулешова Ольга Валерьевна),2025-10-22,70.0,,4440.0,370.0,12.0,Нет опыта,ТК,3/3,Еженедельно,"премии, подарки, скидки, обучение, кофе",Общаться с гостями и работать с кассой. - Поддерживать чистоту и уют в кофейне.,https://hh.ru/vacancy/126443611
Бариста (м. Дмитровская),ДНИ НЕДЕЛИ,2025-10-21,120.0,,3600.0,300.0,13.0,От 1 года до 3 лет,ТК,"2/2, 3/3, 4/3, 5/2",Ежемесячно,"обучение, кофе","Кайфуешь от общения с людьми. Готовить авторские напитки, разумеется, не забывая про классику. Заниматься развитием кофейни и работать над узнаваемостью...",https://hh.ru/vacancy/125857498
Бариста (спешелти),РЭДИС,2025-10-19,,125.0,,,,От 1 года до 3 лет,ТК,5/2,,"питание, кофе",Ресторанное качество уже готовой еды. 5. Участие в дегустациях новых продуктов и в принятии решений об их вводе в меню. ,https://hh.ru/vacancy/125812013
Бариста,BY ME цветы и кофе,2025-10-21,80.0,,,,,От 1 года до 3 лет,ТК,3/3,,,"Работал бариста от 2х лет • Владеет техниками помола и экстракции • Владеет техниками взбивания молока и латте-арт • Любит гостей и хочет быть частью авторского проекта, умеет работать в команде и хочет развиваться • Пунктуален и ответственно относится к своим обязанностям • Умеет соблюдать порядок и чистоту на рабочем месте • Имеет мед.книжку",https://hh.ru/vacancy/125974129
Бариста в кофейню Дринкит (м. Новокузнецкая),Дринкит - сеть кофеен,2025-10-21,55.0,70.0,3300.0,275.0,'5-12,Нет опыта,ТК,5/12,2 раза в месяц,"обучение, кофе",Готовить кофе и другие напитки. Проводить уборку рабочей зоны. Общаться с гостями.,https://hh.ru/vacancy/126541210
Бариста в Сандра БУЛОК,Сандра БУЛОК,2025-10-20,71.0,86.0,4680.0,390.0,12.0,Нет опыта,ТК,"4/3, 5/2, 30/20",,"питание, обучение, кофе","варить вкусный кофе, рассказывать про наши потрясающие булочки, делиться своими открытиями и эмоциями с нашими гостями, погружать их в булочно - кофейный мир, поддерживать порядок и чистоту на своем рабочем месте, развиваться самому и помогать команде становиться еще лучше",https://hh.ru/vacancy/125652633
Бариста в кофейню ONE & DOUBLE,OD BRANDS,2025-10-21,67.5,99.9,3600.0,300.0,12.0,Нет опыта,ТК,"2/2, 3/3, 3/1, 4/2, 5/2, 6/1",,"питание, форма, бонус, бонусы, кофе",Приготовление самых вкусных напитков. Наводить уют в кофейне. Помощь гостю при выборе в меню.,https://hh.ru/vacancy/126362202
Бариста,Кофейня Natura,2025-10-20,75.0,80.0,4200.0,350.0,12.0,Нет опыта,ТК,2/2,,"питание, бонус, бонусы, скидки, обучение, кофе",Готовить кофе и другие напитки по стандартам NATURA. Общаться с гостями и создавать уютную атмосферу.,https://hh.ru/vacancy/125641231
Бариста в кофейню One Price Coffee (м. Новомосковская),OnePrice Coffee,2025-10-21,86.2,,3360.0,280.0,12.0,Нет опыта,ТК,5/2,2 раза в месяц,"форма, премии, бонус, бонусы, обучение, кофе","Готовить лучший кофе в городе, согласно стандартам компании. Общаться с гостями и ориентировать по нашему меню. Работать с кассой (всему...",https://hh.ru/vacancy/126207494
Бариста Coffee Way,Coffee Way,2025-10-21,70.0,100.0,,,,Нет опыта,ТК,2/2,2 раза в месяц,"форма, униформа, обучение","м.Ботанический сад / Свиблово - м.Алексеевская / Рижская - м. Яхромская В каких условиях я буду работать: Ставка + % от продаж. Выход за смену 4000 - 5000 руб Стабильные выплаты два раза в месяц. График работы: 2*2, 3*2, 5*2 Стильная униформа Корпоративное обучение в собственном тренинг-центре Готовы принять в свою команду кандидата, который: имеет навыки обслуживания желает работать и развиваться в сфере обслуживания и продаж общителен, коммуникабелен, доброжелателен, ответственен, аккуратен, обучаем желает и умеет работать в команде Работа в Coffee Way отличается от любой другой работы: здесь царит особая атмосфера в стиле Coffee Way, у нас вырастают настоящие профессионалы своего дела. Мы ведем бизнес открыто, с достоинством и уважением к другим, показывая лучшие результаты.",https://hh.ru/vacancy/125723998
Бармен-кассир/бариста,МОНОЛИТ,2025-10-22,100.0,120.0,,,,Нет опыта,ТК,"2/2, 4/3, 5/2, 3/3",,"питание, бесплатное питание, форма, премии","приготовление и отдача напитков на баре заказ напитков, товаров и расходных материалов у поставщиков контроль чистоты и порядка в зале работа на кассе Резюме без фото не рассматриваются",https://hh.ru/vacancy/126398239
Бариста,Кофейня Beats&Brew,2025-10-21,70.0,85.0,,,,От 1 года до 3 лет,ТК,65/95,2 раза в месяц,"питание, бонус, бонусы, обучение, кофе","Приготовление кофе, чая, вафель по ТТК (делаем из готового теста). Работа с кассой и учёт заказов. Общение с гостями и...",https://hh.ru/vacancy/126787366
"Бариста в Кафе-Пекарню ""Лицей"" (м Войковская)",Кафе-пекарня Лицей,2025-10-21,90.0,,,,'8-12,От 1 года до 3 лет,ТК,"5/2, 2/2, 8/12",2 раза в месяц,"питание, форма, скидки","Собственное производство, с которого каждое утро привозим свежую выпечку и десерты.",https://hh.ru/vacancy/126373906
"Бариста (MioTea, ТЦ Варшавский)",Miotea (ИП Шаповалов Сергей Михайлович),2025-10-20,,83.7,,,,Нет опыта,ТК,2/2,2 раза в месяц,,"* Красивое и быстрое приготовление напитков по тех. Карте * Приготовление заготовок для напитков * Поддержание чистоты * Общение с гостями, работа за кассой",https://hh.ru/vacancy/125905572
Бариста в кофейню Дринкит (м.Китай-Город),Дринкит - сеть кофеен,2025-10-22,53.0,,4560.0,380.0,12.0,Нет опыта,ТК,5/2,,кофе,"Научим дегустировать черный кофе, разбираться в оттенках вкуса, настраивать кофейное оборудование, варить альтернативу и создавать латте-арт.",https://hh.ru/vacancy/126256413
Бариста,Хани Кофе,2025-10-20,90.0,,,,,От 1 года до 3 лет,ТК,"2/2, 3/3, 5/2",,"бонус, бонусы, обучение, кофе",Приготовление кофе и других напитков по стандартам компании; - Обслуживание гостей с улыбкой и вниманием; - Поддержание чистоты и порядка на рабочем месте; - Участие в обучении и развитии навыков; - Ведение учета расходных материалов. Условия работы : - Оплата от 350-450р в час + бонусы; - Оплачиваемое обучение 3000 за смену от 3х до 5 смен; - График работы сменный 2/2; 3/3; 5/2 подберем комфортный для тебя; - Дополнительные бонусы за отличную работу и вклад в команду; - Оплата обеда и бесплатный кофе.,https://hh.ru/vacancy/124189357
Бариста в кофейню Бейджанс,Бейджанс,2025-10-21,60.0,100.0,,,,От 1 года до 3 лет,ТК,5/2,,"питание, форма, бонус, бонусы, обучение, кофе","Поощрение инициативы: наши сотрудники разрабатывают меню, создают дизайны, полностью участвуют в жизни кофейни.",https://hh.ru/vacancy/126569789
Бариста в кофейни WakeCup,Маликов Антон Дмитриевич,2025-10-21,75.0,125.0,420.0,35.0,5.0,Нет опыта,ТК,"1/2, 5/2, 4/3, 2/2",,"форма, кофе",Надо ли сдавать экзамены? - Делать гостей кофейни счастливее. До встречи!,https://hh.ru/vacancy/126772313
Бариста/Бармен,Семейное кафе Здрасте (ООО СКЛ),2025-10-22,95.0,120.0,,,,Нет опыта,ТК,"2/2, 3/2, 4/2, 5/2, 30/19",,"питание, бесплатное питание, форма, униформа, обучение, кофе","Приготовление Без алкогольных напитков чая, кофе, лимонадов, смузи, свежевыжатых соков. Также работа с алкоголем. - Консультирование клиентов по методам приготовления коктейлей/ кофе - Знание профессионального оборудования и его эксплуатации - Поддержание ассортимента - Соблюдение санитарных норм в процессе работы - Поддержание порядка и чистоты на рабочем месте - Проведение инвентаризации - Работа в программе - iiko",https://hh.ru/vacancy/125984636
Бариста в кофейню One Price Coffee (м. Сретенский Бульвар ),OnePrice Coffee,2025-10-21,92.4,,,,,Нет опыта,ТК,5/2,,"питание, обучение, кофе","Приготовление кофейных напитков по утвержденным рецептам Работа с кассой и участие в инвентаризациях Поддержание уютной атмосферы в кофейне, создание позитивного настроения для наших гостей Соблюдение чистоты и порядка на рабочем месте Требования к тебе: Любовь к кофе Приветливость, коммуникабельность, энтузиазм Готовность учиться новому и развиваться профессионально Пунктуальность и ответственность Присоединяйся к нам и стань частью команды, где каждая чашка кофе - это искусство и удовольствие. Мы гарантируем, что ты не только научишься готовить вкуснейший кофе, но и найдешь здесь друзей и возможность развиваться вместе с нами! :)",https://hh.ru/vacancy/126207975
Бариста,Сизонов Игорь Евгеньевич,2025-10-20,70.0,100.0,,,,От 1 года до 3 лет,ТК,5/2,,кофе,"Опыт работы в кофейне (желательно, но можем обучить). Умение готовить кофе, лимонады, бабл-ти или желание научиться. Пунктуальность и ответственность. ",https://hh.ru/vacancy/125898642
Старший бариста/Менеджер кофейни,АО ФК Консортум,2025-10-21,,,5400.0,450.0,12.0,От 1 года до 3 лет,ТК,5/2,2 раза в месяц,"питание, кофе","Организовывать работу кофейни. Контролировать остатки продукции и делать заказы. Обучать новичков, контролировать и организовывать работу сотрудников. Решать местные бытовые задачи. ",https://hh.ru/vacancy/126550502
