Утренний Бариста в кофейню Дринкит (м. Речной вокзал),Дринкит - сеть кофеен,2025-10-22,55.0,70.0,3300.0,275.0,'5-12,Нет опыта,ТК,"5/12, 1/2",2 раза в месяц,"обучение, кофе",Готовить кофе и другие напитки. Проводить уборку рабочей зоны. Общаться с гостями.,https://hh.ru/vacancy/125862427
Старший бариста,ЕМ Кейк,2025-10-21,80.0,130.0,,,12.0,От 1 года до 3 лет,ТК,"2/2, 5/2",,"скидки, обучение, кофе",Руководство командой бариста и координация их работы. Приготовление кофе и других напитков на высшем уровне. Обучение и развитие новых сотрудников. Контроль качества обслуживания и соблюдение стандартов компании. Ведение учета и заказ необходимых ингредиентов и материалов.,https://hh.ru/vacancy/126793297
Бариста/Менеджер в кофейню Кранчи Дрим (Химки),Кранчи Дрим,2025-10-19,80.0,105.0,,,12.0,Нет опыта,ТК,"2/2, 5/2",,"питание, скидки, кофе, чай","Питание на смене - поддерживаем энергией на работе. Готовить кофе и следить за выполнением стандартов. Обучать новичков, контролировать и организовывать работу...",https://hh.ru/vacancy/126488802
"Бариста в лавку ""Братья Караваевы""",Кулинарная лавка братьев Караваевых,2025-10-21,,120.0,,,,Нет опыта,ТК,6/1,2 раза в месяц,"питание, форма, обучение",Консультируют гостей при выборе блюд и напитков. Работают с кассой. Внимательно относятся к чистоте и наполненности витрины. Мы одержимы нашими...,https://hh.ru/vacancy/125719152
Шеф-бариста,Лаборатория Еды,2025-10-20,,,,,,От 3 до 6 лет,ТК,5/2,Еженедельно,"форма, обучение, кофе","Разработка меню и работа за баром Создание сезонного меню (кофе, лимонады, акционные предложения). Введение новых рецептур и их стандартизация. Обучение и развитие команды. Проведение тренингов, аттестаций и регулярных тренировок для бариста. Контроль работы точек Проведение еженедельных аудитов на точках. Контроль соблюдения стандартов приготовления напитков. Помощь в решении вопросов, связанных с работой команды. Наши пожелания к кандидату: Опыт работы от 3 лет в аналогичной должности Глубокие знания о кофе (сорта, способы обжарки, методы заваривания) Умение настраивать помол и работать с оборудованием Наличие действующей медицинской книжки Легкость в общении, дружелюбие и стрессоустойчивость Как преимущество - курсы о повышении квалификации, участие в соревнованиях Опыт открытия кофеен с нуля Готовность к командировкам (например открытие кофеен в СПб )",https://hh.ru/vacancy/126660139
"Бариста в кофейню Дринкит (офис VK, м. Аэропорт)",Дринкит - сеть кофеен,2025-10-22,55.0,70.0,3300.0,275.0,'5-12,Нет опыта,ТК,"5/12, 1/2",2 раза в месяц,"обучение, кофе",Готовить кофе и другие напитки. Проводить уборку рабочей зоны. Общаться с гостями.,https://hh.ru/vacancy/125862431
Бариста в кофейню One Price Coffee (м. Октябрьская),OnePrice Coffee,2025-10-21,92.4,,3600.0,300.0,12.0,Нет опыта,ТК,64/27,2 раза в месяц,"форма, премии, бонус, бонусы, обучение, кофе","Готовить лучший кофе в городе, согласно стандартам компании. Общаться с гостями и ориентировать по нашему меню. Работать с кассой (всему...",https://hh.ru/vacancy/126208010
Начинающий Бариста в кафе-пекарню,FRENCH BAKERY,2025-10-20,,140.0,,,,Нет опыта,ТК,"6/1, 5/2, 3/3, 2/2",,"скидки, обучение, кофе",Приготовление кофе и других напитков по стандартам компании Продажа выпечки и кондитерских изделий Поддержание чистоты и порядка на рабочем месте Работа с кассой,https://hh.ru/vacancy/123216553
Бариста,Alex&Milana,2025-10-19,80.0,85.0,4200.0,350.0,12.0,Нет опыта,ТК,"5/2, 2/2",2 раза в месяц,"кофе, чай","Варить кофе, чай, делать свежевыжатые соки и молочные коктейли. Поддерживать идеальную чистоту и порядок. Обслуживание гостей. Общение с гостями, работать...",https://hh.ru/vacancy/126277231
Бариста,Кривоносов Павел Александрович,2025-10-20,72.0,100.0,3600.0,300.0,12.0,Нет опыта,ТК,5/2,,"обучение, кофе","Выработка от 40ч в неделю Работа на кассе, принятие заказов, расчет посетителей. Приготовление кофе и кофейных напитков с соблюдением стандартов компании. Поддержание чистоты рабочего места и торгового зала. Закрытие смены: мойка оборудования, рабочего места, зала для гостей. Если это про тебя, то ты идеальный кандидат: Желание работать. Высокая степень общительности. Пунктуальность и ответственность. Готовность активно внедряться в рабочий процесс и проявлять инициативу. Готовность к оформлению медицинской книжки (компенсация после полугода работы). Присоединяйтесь к нашей команде в &quot;Coffeeist&quot; и воплотите свою страсть к кофе в профессиональное искусство! Отправьте ваше резюме, и станьте ключевым игроком в создании уникального кофейного опыта для наших ценителей.",https://hh.ru/vacancy/125876372
Бариста в кофейню Дринкит (м. Серпуховская),Дринкит - сеть кофеен,2025-10-20,53.0,63.0,3300.0,275.0,'5-9,Нет опыта,ТК,"4/5, 5/9",,"форма, обучение, кофе",Сделаем тебе медицинскую книжку за наш счет.,https://hh.ru/vacancy/126706428
Бариста-официант в кофейню ROASTER coffee,ROASTER кофе,2025-10-21,85.0,120.0,6000.0,500.0,12.0,От 1 года до 3 лет,ТК,"2/2, 3/2, 4/2",2 раза в месяц,"питание, кофе","Умение работать в команде. Грамотная речь. Ответственность, доброжелательность, готовность к обучению. Знание iiko (желательно). Рассмотрим кандидатов с опытом от 1...",https://hh.ru/vacancy/126779019
Начинающий Бариста/Бармен в мини-кафе,Клепиков Сергей Михайлович,2025-10-22,74.0,91.0,,,,Нет опыта,ТК,5/2,Еженедельно,форма,Приготовление напитков. Поддержание чистоты за баром.,https://hh.ru/vacancy/126134250
Бариста,Промоделдженерейшен,2025-10-21,4.5,5.0,,,10.0,От 1 года до 3 лет,ТК,2/5,,кофе,Обслуживать гостей кофейни. Консультировать по ассортименту кофейни. Вcе оcтальные мoменты oбcуждаютcя нa сoбесeдованиe.,https://hh.ru/vacancy/125980153
Офицант/Бармен/Бариста,PIMS (ИП Тищенков Олег Михайлович),2025-10-19,80.0,105.0,4440.0,370.0,'8-12,Нет опыта,ТК,8/12,2 раза в месяц,"форма, униформа, бонус, бонусы","Качественное и быстрое приготовление напитков. Поддержание порядка и чистоты на рабочем месте. Предоставление фирменного сервиса гостям. Общение с гостями, работа...",https://hh.ru/vacancy/126622539
Бариста ONE PRICE COFFEE,Ван Груп Компани,2025-10-21,,67.5,,,,Нет опыта,ТК,5/2,,"питание, форма, премии, бонус, бонусы, обучение, кофе","Готовить вкусный кофе, создавать отличное настроение гостям, работать с кассой и поддерживать чистоту и уют. Ждем тебя в команду, если ты: Коммуникабельный, энергичный, позитивный, опрятный; Хочешь развивать кофейную экспертизу; Стремишься получить практический опыт в кофейной сфере или прокачать его и вывести на новый уровень; Уже работал в кофейне или пока еще новичок, желающий научиться искусству приготовления кофе :) Уже закончил учебное заведение или точно знаешь, как совмещать учебу и работу! Особенно ждем бариста со станций метро: МЦК Коптево, МЦК Окружная, МЦК Автозаводская, МЦК ЗИЛ, МЦК Дубровка, м. Коломенская, м. Каширская, м. Авиамоторная, м. Шоссе Энтузиастов, м. Перово, м. Нижегородская, МЦК Площадь Гагарина, м. Ленинский проспект, м. Академическая, м. Шаболовская, МЦК Крымская, МЦК Владыкино, м. Молодежная, м. Волоколамская, м. Достоевская, м. Профсоюзная, м. Комсомольская, м. Нагатинская, МЦК Верхние Котлы и др.",https://hh.ru/vacancy/123392346
Бариста в кофейню,SKY GROUP,2025-10-19,82.0,,,,,Нет опыта,ТК,3/3,2 раза в месяц,"скидки, обучение, кофе",* Приготовление кофе и других напитков по авторским рецептам. * Обслуживание клиентов на высоком уровне. * Поддержание чистоты и порядка на рабочем месте. * Работа с кассой и ведение учёта продаж.,https://hh.ru/vacancy/126420555
Бариста в кофейню One Price Coffee (м. Варшавская),OnePrice Coffee,2025-10-21,83.2,,3240.0,270.0,12.0,Нет опыта,ТК,6/1,2 раза в месяц,"форма, премии, бонус, бонусы, обучение, кофе","Готовить лучший кофе в городе, согласно стандартам компании. Общаться с гостями и ориентировать по нашему меню. Работать с кассой (всему...",https://hh.ru/vacancy/126208107
Бариста на флагман HQ! coffee Сити-парк,HQ!,2025-10-16,98.0,155.0,4320.0,360.0,12.0,От 1 года до 3 лет,ТК,64/27,2 раза в месяц,"скидки, кофе",Команда HQ!Coffee в поисках <highlighttext>бариста</highlighttext> в кофейню ЖК Сити-парк. Работа с классным зерном собственной обжарки.,https://hh.ru/vacancy/126601980
Бариста Аэроплан.кофе,Аэроплан. Кофе,2025-10-20,79.5,99.0,4800.0,400.0,'10-12,От 1 года до 3 лет,ТК,"4/3, 10/12",,"питание, кофе","варить действительно вкусный кофе, вываривать из каждого сорта зерна максимум вкуса, делиться своими открытиями и эмоциями с нашими гостями и помогать им погружаться в кофейный мир, поддерживать порядок и чистоту на своем рабочем месте, развиваться самому и помогать команде становиться еще лучше.",https://hh.ru/vacancy/126729811
Бариста-кассир,Павленко Дарья Александровна,2025-10-22,90.0,105.0,,,,Нет опыта,ТК,5/2,,"скидки, обучение, кофе","Готовить вкусный кофе и другие напитки по нашим стандартам. Общаться с гостями, создавать дружескую атмосферу. Работать на кассе и принимать...",https://hh.ru/vacancy/126818409
Начинающий бариста,SKY GROUP,2025-10-20,82.0,,,,,Нет опыта,ТК,3/3,2 раза в месяц,"скидки, обучение, кофе",* Приготовление кофе и других напитков по авторским рецептам. * Обслуживание клиентов на высоком уровне. * Поддержание чистоты и порядка на рабочем месте. * Работа с кассой и ведение учёта продаж.,https://hh.ru/vacancy/126325362
Бариста в Москвариум,Москвариум,2025-10-21,,150.0,,,,От 1 года до 3 лет,ТК,2/2,,"ДМС, питание, бесплатное питание, скидки","🐾 Ищем сотрудника в КапиКафе 🐾 Хочешь работать в крутом месте у Москвариума, рядом с милыми капибарами? Обязанности простые — работать в кафе, радовать посетителей и наслаждаться атмосферой! 😊 Что мы предлагаем: График 2/2 — отдыхай ярко и регулярно Официальное оформление ДМС Бесплатное питание Зарплата 4500 ₽ за смену + премия Скидки на продукцию компании Если хочешь вместе с нами создавать уют и классное настроение — пиши\звони, мы ждем именно тебя! 🚀",https://hh.ru/vacancy/125444879
Бариста-кассир в кафе,Римляне,2025-10-22,70.0,105.0,,,12.0,Нет опыта,ТК,"2/2, 3/3",2 раза в месяц,"питание, бесплатное питание, кофе, чай",Консультировать гостей по меню. * Работать с кассой и принимать заказы. * Следить за порядком на витрине. * Готовить вкуснейшие напитки: кофе/чай...,https://hh.ru/vacancy/126244428
Бариста,SKY GROUP,2025-10-19,82.0,,,,,Нет опыта,ТК,3/3,2 раза в месяц,"скидки, обучение, кофе",* Приготовление кофе и других напитков по авторским рецептам. * Обслуживание клиентов на высоком уровне. * Поддержание чистоты и порядка на рабочем месте. * Работа с кассой и ведение учёта продаж.,https://hh.ru/vacancy/125868284
Бариста,Coffee bean,2025-10-21,80.0,,,,'8-9,Нет опыта,ТК,"5/2, 7/16, 12/20, 8/9",,кофе,Приготовление кофе и других напитков. >Работаем в IIKO. Тренинги и семинары для развития твоих soft & hard skills.,https://hh.ru/vacancy/126106624
Бариста (ТЦ ЦДМ),Томиоми,2025-10-21,75.0,85.0,,,'9-13,Нет опыта,ТК,"9/13, 5/10",2 раза в месяц,"питание, корпоративное питание, форма, кофе","Обслуживать Гостей за кассой и создавать им отличное настроение.  Качественно готовить напитки из меню согласно ТТК.  Соблюдать нормы санитарии , поддерживать...",https://hh.ru/vacancy/126791369
Бариста (Москва сити),FreshCafe,2025-10-21,96.0,,,,8.0,Нет опыта,ТК,5/2,,"питание, форма, униформа, бонус, бонусы, подарки, обучение, проезд, оплата проезда",Приготовление напитков • Работа с кассовой программой IIKO • Общение с гостями • Соблюдение стандартов санитарии на рабочем месте Мы оцениваем в кандидатах: • Опыт работы бариста от 6 месяцев • Организованность • Умение работать в команде,https://hh.ru/vacancy/125815509
Бариста Surf Coffee x Akademik (м. Проспект Вернадского),Surf Coffee,2025-10-20,60.0,90.0,,,,Нет опыта,ТК,5/2,,"питание, форма, униформа, премии, бонус, обучение, кофе","Приготовление напитков по стандартам компании Общение с гостями в формате дружеской беседы Работа с кассой и соблюдение чек-листов Участие в жизни кофейни, командных встречах и предложениях по улучшению Surf Coffee® — это больше, чем работа. Это сообщество, стиль жизни и возможности. Если хочешь расти, развиваться и быть частью команды, которая двигается вперёд — мы ждём именно тебя. We Are Greater Than I",https://hh.ru/vacancy/126639094
Бариста,Желтый Кофе и Бейглы,2025-10-22,70.0,130.0,,,'10-12,От 1 года до 3 лет,ТК,"3/3, 2/2, 3/2, 7/10",,"питание, бонус, бонусы, скидки, кофе","Приготовление напитков по стандартам компании. Настройка помола и работа с кофемашиной. Работа с кассой и обслуживание клиентов. Контроль товарных остатков и составление заказов на продукцию. Выкладка выпечки, десертов и напитков. Прием поставок и поддержание чистоты на рабочем месте.",https://hh.ru/vacancy/126478255
Начинающий бариста в ONE & DOUBLE,OD BRANDS,2025-10-20,67.5,99.0,3600.0,300.0,12.0,Нет опыта,ТК,"2/2, 3/3, 3/1, 4/2, 5/2, 6/1",,"питание, форма, бонус, бонусы, кофе",Приготовление самых вкусных напитков. Наводить уют в кофейне. Помощь гостю при выборе в меню.,https://hh.ru/vacancy/126508436
"Бариста (Кофейня ""Аленка"", м. Новослободская)",Группа Гута,2025-10-22,95.0,,,,,Нет опыта,ТК,2/2,2 раза в месяц,"питание, бесплатное питание, скидки, кофе",Качественное обслуживание гостей кофейни. Приготовление напитков по стандартам компании. Консультирование посетителей по ассортименту кофейни и помощь в выборе блюд. ,https://hh.ru/vacancy/126816756
Бариста в кафе,ВНБ,2025-10-21,50.0,117.0,3600.0,300.0,12.0,От 1 года до 3 лет,ГПХ,"2/2, 3/3, 5/2",,"питание, кофе","Приготовление и продажа высококачественного кофе, чая и других напитков Уход за оборудованием и инвентарем Соблюдение стандартов качества и профессионализма, определенных компанией Ведение документации и контроль за наличием ингредиентов и прочих расходных материалов Оформление витрин в зоне кафе Контроль за остатками товара и сроков годности Кассовая дисциплина",https://hh.ru/vacancy/126769872
Бариста в OnePriceCoffee,OnePriceCoffee (ИП Сулейманов Адыгезал Озухан Оглы),2025-10-21,4.5,5.5,267600.0,22300.0,12.0,Нет опыта,ТК,"2/2, 5/2",,,"Общаться с гостями и ориентировать в нашем меню, - Готовить вкуснейшие напитки соблюдая стандарты качества компании; — Помогать гостям оплатить свой заказ, используя кассу, терминал, приложение; - Поддерживать порядок на рабочем",https://hh.ru/vacancy/126793600
Бариста,FreshCafe,2025-10-21,96.0,,,,8.0,Нет опыта,ТК,5/2,,"питание, форма, униформа, бонус, бонусы, подарки, обучение, проезд, оплата проезда",Приготовление напитков • Работа с кассовой программой IIKO • Общение с гостями • Соблюдение стандартов санитарии на рабочем месте Мы оцениваем в кандидатах: • Опыт работы бариста от 6 месяцев • Организованность • Умение работать в команде,https://hh.ru/vacancy/125450802
Бармен-бариста в ресторан “Parfe Cafe” (м. Зюзино),Парфэ,2025-10-19,90.0,130.0,,,12.0,Нет опыта,ТК,"2/2, 3/3",2 раза в месяц,"форма, обучение, кофе","Создавать алкогольные и безалкогольные коктейли. Готовить свежевыжатые соки, лимонады, смузи и прохладительные напитки. Обслуживать гостей, создавая атмосферу уюта и заботы. ",https://hh.ru/vacancy/126032417
Бариста в кофейню One Price Coffee (м. Новослоботская),OnePrice Coffee,2025-10-21,73.9,,3360.0,280.0,12.0,Нет опыта,ТК,64/27,2 раза в месяц,"форма, премии, бонус, бонусы, обучение, кофе","Готовить лучший кофе в городе, согласно стандартам компании. Общаться с гостями и ориентировать по нашему меню. Работать с кассой (всему...",https://hh.ru/vacancy/126207541
Бариста в specialty кофейню YCP / YourCoffeePlace,YourCoffeePlace,2025-10-20,80.0,95.0,4560.0,380.0,12.0,От 1 года до 3 лет,ТК,"2/2, 9/22, 10/22",,кофе,"Опыт работы <highlighttext>бариста</highlighttext> от полугода. Уверенный базовый латте-арт (сердце, тюльпан). Умение работы с альтернативными методами заваривания (фильтр, воронка). Ответственного. ",https://hh.ru/vacancy/125656489
