Должность,Работодатель,Дата публикации,ЗП от (т.р.),ЗП до (т.р.),Средний совокупный доход при графике 2/2 по 12 часов,В час,"Длительность 
смены","Требуемый
опыт",Труд-во,График,"Частота 
выплат",Льготы,Обязаности,Ссылка
Бариста в кофейню (без опыта) | 120 000 рублей,Сфера,2025-10-22,80.0,120.0,5400.0,450.0,12.0,Нет опыта,ТК,"2/2, 3/1, 3/3, 5/2, 2/3",,"форма, бонус, бонусы, обучение, кофе","Напитки: от классики до авторских. Завтраки и бранчи. Выпечку собственного производства. Форматы: To-Go и Counter Service. Немного нетворкинга, коворкинга...",https://hh.ru/vacancy/126452362
Бариста в кафе,Цурио,2025-10-21,6.5,8.0,,,,Нет опыта,ТК,5/2,Еженедельно,"питание, форма, униформа, скидки, кофе","Тебе предстоит много общаться, рассказывать гостям про ассортимент и самые интересные новинки, ну и конечно же создавать атмосферу и готовить...",https://hh.ru/vacancy/126776069
Бариста,STARS COFFEE,2025-10-21,,,,,,Нет опыта,ТК,64/27,,"обучение, кофе",Готовить напитки и подавать наши супер-десерты. - Проводить оплату по кассовому аппарату. - Поддерживать дружелюбную атмосферу в кофейне и заряжать гостей...,https://hh.ru/vacancy/112334568
Продавец-бариста в сеть кофеен French Bakery,FRENCH BAKERY,2025-10-21,100.0,,,,,Нет опыта,ТК,"12/13, 5/2",,"премии, обучение, кофе",Работа за кассой( ПО IIko). Работа с кофемашиной (рожковая). Общение с гостями. Активные продажи продукции кафе. Приготовление напитков. Выкладка витрин. ,https://hh.ru/vacancy/126184382
Бариста в сетевую кофейню YesNoMilk,Саб-Сервис,2025-10-20,90.0,,,,,Нет опыта,ТК,"5/2, 6/1",Ежемесячно,"питание, бесплатное питание, форма, премии, обучение, кофе","...развитию и карьерному росту (<highlighttext>бариста</highlighttext> может участвовать в развитии меню напитков, стать старшим <highlighttext>бариста</highlighttext> или шеф-<highlighttext>бариста</highlighttext>, участвовать в чемпионатах).",https://hh.ru/vacancy/126309030
Бариста в кофейню Lintu,Кофейня Lintu,2025-10-20,64.0,115.0,5160.0,430.0,12.0,Нет опыта,ТК,"5/2, 2/2, 4/3, 3/3, 3/2, 6/1",,"бонус, кофе",Кормим и предоставляем кофейную классику в течение всей твоей смены.,https://hh.ru/vacancy/125842729
"Бариста-бармен в ресторан ""Вадваре""",Краденый Артишок,2025-10-21,100.0,,,,,От 1 года до 3 лет,ТК,4/2,,"питание, бесплатное питание, кофе","Приготовление кофейных и авторских напитков по техкарте, — Работа с алкоголем (в том числе с шейкером), — Участие в создании домашних сиропов и заготовок, — Работа с кассой (iiko — при необходимости обучим), — Подготовка рабочего места к открытию и закрытию, — Поддержание чистоты и порядка на рабочем месте. Что предлагаем: — Работа на кофемашине La Marzocco KB90, — Возможность совершенствовать навыки латте-арта в спокойной обстановке, — Поддержка в развитии слабых сторон — технически и творчески, — Мобильность внутри команды: при желании можно перейти на кассу или в зал.",https://hh.ru/vacancy/126107980
"Тренер-бариста/специалист по чаю, кофе (Москва, Московская область)",Старый Мастер,2025-10-20,100.0,,,,,От 1 года до 3 лет,ТК,5/2,,"бонус, бонусы, скидки, проезд, кофе, чай","Проведение обучающих программ: Разработка и проведение тренингов для бариста и персонала клиентов (как на нашей площадке, так и с выездом). Технический эксперт: Диагностика, обслуживание и настройка профессионального кофейного оборудования на точках клиентов. Презентации и продвижение: Проведение совместных с менеджерами по продажам дегустаций и презентаций продукции для ключевых клиентов. Участие в отраслевых мероприятиях: Представление компании на выставках, чемпионатах и корпоративных событиях. Аналитика и отчетность: Ведение регулярной отчетности по проведенным мероприятиям и эффективности обучающих программ. Мы ожидаем от кандидата: Опыт работы тренером в кофейной индустрии от 1 года. Подтвержденные знания в области кофе (наличие сертификатов SCA или аналогичных будет значительным преимуществом). Практический опыт настройки и обслуживания различного кофейного оборудования. Навыки систематизации работы и грамотной подготовки отчетной документации. Клиентоориентированность и развитые коммуникативные навыки. Готовность к командировкам и гибкий график в рамках рабочих задач. Знания в области чайного направления приветствуются. Профессиональные и личные качества: Стремление к профессиональному развитию и глубокому погружению в кофейную тематику. Проактивная позиция, нацеленность на достижение измеримых результатов. Ответственность и самостоятельность. Умение работать в команде и выстраивать долгосрочные партнерские отношения с клиентами.",https://hh.ru/vacancy/126725579
Начинающий Бариста,Клепиков Сергей Михайлович,2025-10-20,74.0,91.0,,,,Нет опыта,ТК,64/27,Еженедельно,"форма, обучение",Приготовление напитков. Поддержание чистоты за баром.,https://hh.ru/vacancy/126426029
Бариста,Yumbaker,2025-10-21,91.5,113.5,5700.0,475.0,'8-12,От 1 года до 3 лет,ТК,"4/3, 8/12",,"питание, обучение, кофе","варить действительно вкусный кофе, вываривать из каждого сорта зерна максимум вкуса, делиться своими открытиями и эмоциями с нашими гостями и помогать им погружаться в кофейный мир, поддерживать порядок и чистоту на своем рабочем месте, развиваться самому и помогать команде становиться еще лучше.",https://hh.ru/vacancy/126179747
Бариста,STARS COFFEE (ООО Самоцвет),2025-10-22,,,,,,Нет опыта,ТК,5/2,,"обучение, кофе",Готовить напитки и подавать наши супер-десерты. - Проводить оплату по кассовому аппарату. - Поддерживать дружелюбную атмосферу в кофейне и заряжать гостей...,https://hh.ru/vacancy/126516766
Бариста в кофейню Дринкит,Дринкит - сеть кофеен,2025-10-22,55.0,70.0,3300.0,275.0,'5-12,Нет опыта,ТК,5/12,2 раза в месяц,"обучение, кофе",Готовить кофе и другие напитки. Проводить уборку рабочей зоны. Общаться с гостями.,https://hh.ru/vacancy/125862429
Бариста в кофейню-корнер Kristof,Варданян Нарек Хачикович,2025-10-22,85.0,110.0,,,,Нет опыта,ТК,"5/2, 4/3, 3/2",2 раза в месяц,"питание, бесплатное питание, бонус, обучение, кофе",Активно и ответственно обращаться с кассой (iIko). Умение продавать (хороший средний чек и продажи в час). Опыт работы в Specialty...,https://hh.ru/vacancy/126230330
Шеф-бариста в ресторан,Мегарест,2025-10-22,110.0,140.0,,,,От 1 года до 3 лет,ТК,"18/19, 5/2, 4/3",,"обучение, кофе","Соблюдение стандартов обслуживания и сервиса Приготовление кофейных напитков Глубокие познания в альтернативных кофейных напитках Разработка меню кофе Обучение младших сотрудников Т ребования: Готовность работать в команде Интерес к ресторанной сфере Опыт работы не обязателен Условия Полная занятость, сменный график, смены дневные Начальная зарплата 110000 рублей + премиальные от роста продаж График с 8 до 18-19 / 5/2 или 4/3 оформление по ТК оплачиваемая стажировка",https://hh.ru/vacancy/126621501
Бариста в кофейню Glitch Coffee,Glitch Coffee,2025-10-21,70.0,,3900.0,325.0,12.0,Нет опыта,ТК,5/2,,"питание, бесплатное питание, обучение, проезд, кофе","Готовить напитки на профессиональной рожковой кофемашине; Работать с кассой; Создавать и поддерживать заботливую атмосферу для наших гостей и чистоту в кофейне. Кого мы ищем: Коммуникабельного и дружелюбного человека; Ответственного и внимательного к деталям, готового учиться и развиваться вместе с командой; Увлеченного кофейной культурой и стремящегося делиться своим опытом с другими. Вакансии открыты по адресам: - Покровский бульвар, 11с4, м. Курская; - Верейская улица 17 | БЦ Верейская Плаза 2, м. Давыдково; - Малая Пионерская улица 12, м. Павелецкая; - Варшавское шоссе 1с6 | БЦ W-Plaza 2, м. Тульская; - Измайловское шоссе 44с2, м. Семеновская; - Улица Малая Ордынка 17, м. Третьяковская; - Улица Нобеля 3, м. Сколково; - Бумажный проезд 19с4, м Савеловская; - Улица Сущевский Вал, 49, м. Марьина Роща. Хочешь к нам? Оставляй отклик — и мы свяжемся в течение суток. Наша команда ждёт тебя!",https://hh.ru/vacancy/126559037
Бариста,Air Coffee,2025-10-21,85.0,115.0,4440.0,370.0,12.0,Нет опыта,ТК,7/13,2 раза в месяц,"форма, обучение, кофе","Качественно и вкусно готовить кофе и другие напитки; Консультирование посетителей по ассортименту кофейни; Дружелюбное общение с гостями; Работа с кассой и терминалом; Содержание порядка на рабочем месте и в зале; Прием и выкладка товаров; Проведение инвентаризации (раз в месяц ); Требования : Ответственное отношение к работе; Пунктуальность; Чистоплотность; Мед. книжка (есть возможность оформления работодателем); Опыт работы от 3х месяцев в должности бариста как преимущество, но возможно обучение; Навык приготовления кофе альтернативными способами приветствуется;",https://hh.ru/vacancy/125859484
Бариста в кофейню,Skuratov Coffee,2025-10-20,63.0,70.0,,,'7-10,Нет опыта,ТК,7/10,,"питание, корпоративное питание, обучение, кофе","От вас: Любить людей, быть открытыми и много учиться. Любить кофе и не бояться менять рынок вместе с нами.",https://hh.ru/vacancy/125877434
Бариста,SKOLKOVO GOLF CLUB,2025-10-19,100.0,100.0,,,,Нет опыта,ТК,2/2,,"ДМС, питание, корпоративное питание, транспорт, кофе, чай","Обслуживать посетителей за контактной барной стойкой фитнес- клуба. Готовить кофе, чай и другие напитки. Следить за сроками годности ингредиентов. Поддерживать чистоту и порядок на рабочем месте. Соблюдать высокие стандарты обслуживания. Получать оплату за приобретенные продукты.​​​​​​​ Как стать частью нашей команды: Опыт работы бариста от 6 месяцев. Знание основ спортивного питания и увлечение фитнесом. Умение работать с рожковой кофемашиной. Навык приготовления напитков по технологическим картам. Ориентированность на клиента и умение находить общий язык с людьми. Коммуникабельность и грамотная речь.",https://hh.ru/vacancy/125795006
Старший бариста,Эй.Ви.Эм. Групп,2025-10-21,100.0,150.0,,,,От 1 года до 3 лет,ТК,"5/2, 6/1",,"бонус, бонусы, кофе","Приготовление холодных и горячих напитков согласно ТТК. Помощь на кухне, если вдруг запара, приветствуется, тк мы Команда, но она требует я далеко не всегда. Поддержание чистоты. Любовь к Продукту, к тому, что Вы делаете. Готовность отдаваться работе, получая симметричную отдачу и бонусы и расти вместе с Компанией и развиваться.",https://hh.ru/vacancy/125675566
Бариста,Дон Кофеоне,2025-10-21,4.8,7.0,,,,От 1 года до 3 лет,ТК,"2/2, 3/3",,"форма, обучение, кофе","Приготовление напитков Общение с гостями: без жёстких стандартов и навязывания допов, но с душой, чтобы человек захотел прийти ещё Приёмка товара, составление заявок Работа с кассой Проведение инвентаризации: раз в смену, каждый отвечает за себя Чего мы ждём от кандидата : Умение общаться с людьми, доброжелательность Пунктуальность и ответственное отношение к работе Опыт работы не обязателен, но будет преимуществом Желательно наличие медкнижки или готовность оперативно её оформить (оплачивается компанией)",https://hh.ru/vacancy/125954578
Шеф-бариста,Омнипродукт,2025-10-22,100.0,,,,,От 1 года до 3 лет,ТК,5/2,,"подарки, скидки, обучение, кофе","развитие направления кофейных напитков и сопутки к ним в действующей сети гастробаров; объезд по точкам, контроль качества кофе, создания кофейного вайба в заведениях, прививание гостям кофейной культуры; обучение и контроль работы бариста; работа за контактной стойкой.",https://hh.ru/vacancy/125791087
Бариста-Продавец в команду FRENCH BAKERY,FRENCH BAKERY,2025-10-20,,140.0,,,,Нет опыта,ТК,"2/2, 3/3, 5/2, 6/1",2 раза в месяц,"питание, бесплатное питание, скидки, обучение, кофе","Приготовление кофе и других напитков по стандартам компании Обслуживание гостей и создание приятной атмосферы Продажа свежей выпечки и кондитерских изделий Поддержание порядка на рабочем месте Работа с кассой и ведение отчетности Преимущества работы у нас: Поддержка на всех этапах работы Возможность профессионального роста и обучения Скидки на продукцию кофейни Подберем для ВАС место работы ближе к дому Стань частью команды FRENCH BAKERY SeDelice, откликайся на вакансию — мы обязательно ответим :)",https://hh.ru/vacancy/119644511
Начинающий бариста в кофейню ONE & DOUBLE,OD BRANDS,2025-10-20,62.5,99.9,3000.0,250.0,12.0,Нет опыта,ТК,"2/2, 3/3, 3/1, 4/2, 5/2, 6/1",,"питание, форма, бонус, бонусы, кофе",Приготовление самых вкусных напитков. Наводить уют в кофейне. Помощь гостю при выборе в меню.,https://hh.ru/vacancy/126721002
Бариста/Буфетчик,ФГБУ «Национальный медицинский исследовательский центр травматологии и ортопедии имени Н.Н. Приорова» Минздрава России,2025-10-22,100.0,,,,,От 1 года до 3 лет,ТК,2/2,,кофе,"Прием заказов на напитки, кондитерские изделия, другие готовые продукты питания непосредственно от посетителей. -Обслуживание посетителей заведения напитками и закусками за барной стойкой и столиками буфета. -Приготовление и подача напитков, свежевыжатых соков и прочих напитков в баре. - Мытье использованной посуды, уборка и уход за служебными помещениями в баре, стойками для приготовления чая или кофе и оборудованием, таким как кофейные машины. - Содействие в своевременном пополнении запасов в баре. - Оформление витрины и барной стойки буфета.",https://hh.ru/vacancy/126804499
Утренний Бариста в кофейню Дринкит (м. Войковская),Дринкит - сеть кофеен,2025-10-22,55.0,70.0,3300.0,275.0,'5-12,Нет опыта,ТК,"5/12, 1/2",2 раза в месяц,"обучение, кофе",Готовить кофе и другие напитки. Проводить уборку рабочей зоны. Общаться с гостями.,https://hh.ru/vacancy/126439961
Продавец-бариста в сеть кофеен FRENCH BAKERY,FRENCH BAKERY,2025-10-22,,140.0,5040.0,420.0,12.0,Нет опыта,ТК,5/2,,"премии, скидки, обучение, кофе",Работа за кассой( ПО IIko). Работа с кофемашиной (рожковая). Общение с гостями. Активные продажи продукции кафе. Приготовление напитков. Выкладка витрин. ,https://hh.ru/vacancy/126188494
Бариста в кафе,Norme,2025-10-21,80.0,130.0,,,,Нет опыта,ТК,"2/2, 3/2, 5/2",2 раза в месяц,"питание, бесплатное питание, форма, премии, кофе, чай","◾ Подготовка зала к работе. ◾ Принятие заказа, расчет гостей — R-keeper ◾Приготовление напитков (чай, кофе, протеиновые шейки). Обслуживание гостей в зале (прием заказов, консультация по меню, отдача блюд).",https://hh.ru/vacancy/123327356
"Бариста в сеть кофеен ""Кофепорт""",Малюк Дарья Сергеевна,2025-10-21,100.0,130.0,,,,Нет опыта,ТК,"5/2, 2/2",,"питание, форма, униформа, бонус, бонусы, кофе",Готовить кофейные напитки на автоматической кофемашине. Помогать гостям в выборе продукции. Работать с кассой. Поддерживать чистоту на рабочем месте.,https://hh.ru/vacancy/126562958
Бариста в кофейню One Price Coffee (м. 1905),OnePrice Coffee,2025-10-22,92.4,,,,,Нет опыта,ТК,5/2,,"питание, обучение, кофе","Приготовление кофейных напитков по утвержденным рецептам Работа с кассой и участие в инвентаризациях Поддержание уютной атмосферы в кофейне, создание позитивного настроения для наших гостей Соблюдение чистоты и порядка на рабочем месте Требования к тебе: Любовь к кофе Приветливость, коммуникабельность, энтузиазм Готовность учиться новому и развиваться профессионально Пунктуальность и ответственность Присоединяйся к нам и стань частью команды, где каждая чашка кофе - это искусство и удовольствие. Мы гарантируем, что ты не только научишься готовить вкуснейший кофе, но и найдешь здесь друзей и возможность развиваться вместе с нами! :)",https://hh.ru/vacancy/126388128
"Бариста в пекарню ""Лицей""",Кафе-пекарня Лицей,2025-10-21,80.0,90.0,,,'8-12,Нет опыта,ТК,"5/2, 2/2, 8/12",2 раза в месяц,"питание, форма, скидки","Собственное производство, с которого каждое утро привозим свежую выпечку и десерты. Планируем коктейльное меню и винную карту ближе к концу...",https://hh.ru/vacancy/126374004
